{
  "source_id": "src-001",
  "title": "Official Evaluation Protocol v3",
  "url": "https://example.org/specs/eval-v3",
  "source_type": "technical_spec",
  "authority_level": "primary",
  "stability": "stable",
  "supports_claims": ["claim-01"],
  "contradicts_claims": ["claim-07"],
  "notes": "Defines metric normalization details used in current benchmark suites."
}
